監測主題,標題,內容,來源,來源網站,主文/回文,發佈時間,討論串總則數,點閱數,作者,正面強度,負面強度 ,原始連結
氣炸鍋|汽炸鍋|氣炸锅,請問氣炸鍋和有蒸烤的微波爐有什麼不同？,"兩者共同點都是標榜健康無油,不過感覺蒸烤型微波爐 能玩出的花樣比較多耶,且使用方式比較簡單(氣炸鍋感覺還是需要些基本料理技巧XD) 像日立LV300T、GV300T這系列的蒸烤型微波爐.就都標榜多食譜功能 且全中文化介面,舉凡蛋糕炸豬排...等各式料理都難不倒,感覺廚房都可省了XD",討論區,美妝INTALKING > 居家生活,回文,2013-12-31 16:41:25,5,2871,music,0.218,0.188,http://intalking.com/thread-208665-1-1.html
氣炸鍋|汽炸鍋|氣炸锅,【按讚+留言★抽氣炸鍋54道食譜書1本，共抽出十位幸運兒】...,【按讚+留言★抽氣炸鍋54道食譜書1本，共抽出十位幸運兒】 momo購物網於12/22周日在誠品Cooking Studio舉辦飛利浦新款氣炸鍋體驗活動，現場邀請到型男主廚陳秉文來示範料理，主廚當天總共設計5道料理外加1道隱藏版聖誕料理，五道料理分別是【脆皮啤酒鵝】【剝皮辣椒風味牛肉捲】【堅果豬肉丸佐蘋果泥】【綠咖哩椰香雞】【鍋塌黃金豆腐】，至於隱藏版聖誕料理是什麼哩????將！將！是令女孩們尖叫的蜜糖吐司耶(小編當天尖叫慘了~~~~)主廚所做的每道料理都不添加任何油脂喔，每一道料理做完主廚都會裝進透明杯給我們看有多油！小編不騙你，看到杯子裡的油你真的會嚇一大跳用氣炸鍋做料理真的很健康，歐洲氣旋科技可降低油脂含量最高達80%，就連愛美的女性和小朋友吃了一口接一口耶！家電課長為了感謝momo會員如此踴躍報名參加此次體驗活動特地加碼延長氣炸鍋往生價時間！真的是最後一檔【飛利浦】免油健康氣炸鍋(HD-9220)白色(M)下殺$5980↓ http://www.momoshop.com.tw/goods/GoodsDetail.jsp?i_code=2195376&&cid=fb1231&oid=1300當天主廚使用的新款【飛利浦】免油健康氣炸鍋HD9240 (約5人份)在這裡↓加碼送飛利浦電磁爐http://www.momoshop.com.tw/goods/GoodsDetail.jsp?i_code=2367802&cid=fb1231&oid=1300趕緊來按讚+留言【momo飛利浦★讓您食在安心】就有機會抽中氣炸鍋54道食譜書1本喔！,社群網站,facebook粉絲團 > momo富邦購物網,主文,2013-12-31 13:16:52,599,2291,momo富邦購物網,0.513,0.382,http://www.facebook.com/permalink.php?story_fbid=10152091876718431&id=165449553430
氣炸鍋|汽炸鍋|氣炸锅,鴨油烤薯塊(氣炸鍋),"不能正經兄說鴨油炸薯條很香 回應""很肥"" 但 腦波超弱 揮之不去那香鬆軟熱騰騰馬鈴薯滋味誘惑 是的 回家就立馬把鴨油和馬鈴薯配對 ' 材料 1.馬鈴薯 2.鴨油 3.香料鹽 ' 做法 1.馬鈴薯放入水中煮滾後,再煮5分鐘,瀝乾放涼切塊 2.馬鈴薯塊均勻沾到鴨油和香料鹽 3.放入氣炸鍋200度10分鐘 ' 為什麼這麼肥滋滋東西 這麼好吃又這麼好做啊(吃完抱頭懊惱)",部落格,udn部落格 > 最多回應,主文,2013-12-31 09:06:08,3,0,ritayang3399,0.45,0.514,http://blog.udn.com/ritayang3399/10140786
氣炸鍋|汽炸鍋|氣炸锅,"好康分享給大家~上傳寶寶照片就能抽""奶粉、iPad mini、氣炸鍋、新光三越禮券…""",謝謝分享~,討論區,ISWII美妝新聞台 > 好康情報,回文,2013-12-31 00:00:00,4,0,riva1979,0.38,0,http://forum.iswii.net/forum/3/ftopic/11819
氣炸鍋|汽炸鍋|氣炸锅,登百貨十大夯品蛋捲機靠食安崛起,食安亮紅燈，民眾開始想要自己來動手做料理，也讓麵包機、氣炸鍋等商品意外成了新寵兒，有台灣業者更是設計出自動蛋捲機，只要丟進雞蛋，就能自動做好一份日式蛋捲，號稱還擁有玉子燒的口感，算是懶人料理機，推出才短短2個月，不但全球熱銷5萬台，同類型的蛋捲機也跟著在網購通路熱銷，還登上百貨十大年度夯品。 香噴噴的玉子燒，家事達人親自示範，用高湯調味的蛋汁一層成形，翻動平底鍋，再包上一層，火侯得要拿捏得當，才能做出美味的日式蛋捲，但如果不擅長下廚，現在也有這種自動蛋捲機，熱水瓶大小，只留下直徑3公分小洞口，把蛋打成蛋汁倒入，蛋汁在瓶身內慢慢加熱，不斷冒泡，就怕只有蛋太單調，甚至還能塞進火腿肉。 業者黃先生：「內部食物已經熟了之後，它會依照內部氣壓，讓它把煮熟的食物自動推上來。」 利用熱脹冷縮原理，讓蛋捲自動成形，幾乎完全不用自己動手，號稱有日式玉子燒口感，我們把成品和老師手工作的玉子燒，請民眾試吃看看。記者：「比較喜歡哪一個？」民眾：「這個(蛋捲機做的)。」記者：「為什麼？」民眾：「因為蛋捲機做的比較Q。」 民眾：「這個(手工)比較綿密。」 手工做的層次分明，有綿密口感，蛋捲機做的口感Q滑，各有愛好者；事實上因為食安問題，有台灣業者自行研發蛋捲機，從上市至今，已經熱銷5萬台，而在網購通路，凡是叫蛋捲機的商品，都賣得嚇嚇叫，意外登上百貨十大年度夯品排行榜。,新聞,MSN新聞 > 生活新聞,主文,2013-12-30 20:09:00,0,0,TVBS新聞,0.503,0.237,http://news.msn.com.tw/./news3500494.aspx
氣炸鍋|汽炸鍋|氣炸锅,登百貨十大夯品蛋捲機靠食安崛起,食安亮紅燈，民眾開始想要自己來動手做料理，也讓麵包機、氣炸鍋等商品意外成了新寵兒，有台灣業者更是設計出自動蛋捲機，只要丟進雞蛋，就能自動做好一份日式蛋捲，號稱還擁有玉子燒的口感，算是懶人料理機，推出才短短2個月，不但全球熱銷5萬台，同類型的蛋捲機也跟著在網購通路熱銷，還登上百貨十大年度夯品。 香噴噴的玉子燒，家事達人親自示範，用高湯調味的蛋汁一層成形，翻動平底鍋，再包上一層，火侯得要拿捏得當，才能做出美味的日式蛋捲，但如果不擅長下廚，現在也有這種自動蛋捲機，熱水瓶大小，只留下直徑3公分小洞口，把蛋打成蛋汁倒入，蛋汁在瓶身內慢慢加熱，不斷冒泡，就怕只有蛋太單調，甚至還能塞進火腿肉。 業者黃先生：「內部食物已經熟了之後，它會依照內部氣壓，讓它把煮熟的食物自動推上來。」 利用熱脹冷縮原理，讓蛋捲自動成形，幾乎完全不用自己動手，號稱有日式玉子燒口感，我們把成品和老師手工作的玉子燒，請民眾試吃看看。記者：「比較喜歡哪一個？」民眾：「這個(蛋捲機做的)。」記者：「為什麼？」民眾：「因為蛋捲機做的比較Q。」 民眾：「這個(手工)比較綿密。」 手工做的層次分明，有綿密口感，蛋捲機做的口感Q滑，各有愛好者；事實上因為食安問題，有台灣業者自行研發蛋捲機，從上市至今，已經熱銷5萬台，而在網購通路，凡是叫蛋捲機的商品，都賣得嚇嚇叫，意外登上百貨十大年度夯品排行榜。,新聞,pchome新聞 > 生活,主文,2013-12-30 19:53:24,0,0,蔡宜靜,0.503,0.237,http://news.pchome.com.tw/living/tvbs/20131230/index-13884044040817239009.html
氣炸鍋|汽炸鍋|氣炸锅,登百貨十大夯品蛋捲機靠食安崛起,食安亮紅燈，民眾開始想要自己來動手做料理，也讓麵包機、氣炸鍋等商品意外成了新寵兒，有台灣業者更是設計出自動蛋捲機，只要丟進雞蛋，就能自動做好一份日式蛋捲，號稱還擁有玉子燒的口感，算是懶人料理機，推出才短短2個月，不但全球熱銷5萬台，同類型的蛋捲機也跟著在網購通路熱銷，還登上百貨十大年度夯品。 香噴噴的玉子燒，家事達人親自示範，用高湯調味的蛋汁一層成形，翻動平底鍋，再包上一層，火侯得要拿捏得當，才能做出美味的日式蛋捲，但如果不擅長下廚，現在也有這種自動蛋捲機，熱水瓶大小，只留下直徑3公分小洞口，把蛋打成蛋汁倒入，蛋汁在瓶身內慢慢加熱，不斷冒泡，就怕只有蛋太單調，甚至還能塞進火腿肉。 業者黃先生：「內部食物已經熟了之後，它會依照內部氣壓，讓它把煮熟的食物自動推上來。」 利用熱脹冷縮原理，讓蛋捲自動成形，幾乎完全不用自己動手，號稱有日式玉子燒口感，我們把成品和老師手工作的玉子燒，請民眾試吃看看。記者：「比較喜歡哪一個？」民眾：「這個(蛋捲機做的)。」記者：「為什麼？」民眾：「因為蛋捲機做的比較Q。」 民眾：「這個(手工)比較綿密。」 手工做的層次分明，有綿密口感，蛋捲機做的口感Q滑，各有愛好者；事實上因為食安問題，有台灣業者自行研發蛋捲機，從上市至今，已經熱銷5萬台，而在網購通路，凡是叫蛋捲機的商品，都賣得嚇嚇叫，意外登上百貨十大年度夯品排行榜。   ,新聞,TVBS新聞 > 影音專區,主文,2013-12-30 19:53:00,0,0,蔡宜靜,0.501,0.236,http://news.tvbs.com.tw/entry/515901
氣炸鍋|汽炸鍋|氣炸锅,登百貨十大夯品蛋捲機靠食安崛起,食安亮紅燈，民眾開始想要自己來動手做料理，也讓麵包機、氣炸鍋等商品意外成了新寵兒，有台灣業者更是設計出自動蛋捲機，只要丟進雞蛋，就能自動做好一份日式蛋捲，號稱還擁有玉子燒的口感，算是懶人料理機，推出才短短2個月，不但全球熱銷5萬台，同類型的蛋捲機也跟著在網購通路熱銷，還登上百貨十大年度夯品。 香噴噴的玉子燒，家事達人親自示範，用高湯調味的蛋汁一層成形，翻動平底鍋，再包上一層，火侯得要拿捏得當，才能做出美味的日式蛋捲，但如果不擅長下廚，現在也有這種自動蛋捲機，熱水瓶大小，只留下直徑3公分小洞口，把蛋打成蛋汁倒入，蛋汁在瓶身內慢慢加熱，不斷冒泡，就怕只有蛋太單調，甚至還能塞進火腿肉。 業者黃先生：「內部食物已經熟了之後，它會依照內部氣壓，讓它把煮熟的食物自動推上來。」 利用熱脹冷縮原理，讓蛋捲自動成形，幾乎完全不用自己動手，號稱有日式玉子燒口感，我們把成品和老師手工作的玉子燒，請民眾試吃看看。記者：「比較喜歡哪一個？」民眾：「這個(蛋捲機做的)。」記者：「為什麼？」民眾：「因為蛋捲機做的比較Q。」 民眾：「這個(手工)比較綿密。」 手工做的層次分明，有綿密口感，蛋捲機做的口感Q滑，各有愛好者；事實上因為食安問題，有台灣業者自行研發蛋捲機，從上市至今，已經熱銷5萬台，而在網購通路，凡是叫蛋捲機的商品，都賣得嚇嚇叫，意外登上百貨十大年度夯品排行榜。 ,新聞,Hinet > 生活新聞,主文,2013-12-30 19:53:00,0,0,TVBS,0.502,0.237,http://times.hinet.net/news/14962719?m=cl
氣炸鍋|汽炸鍋|氣炸锅,登百貨十大夯品蛋捲機靠食安崛起,食安亮紅燈，民眾開始想要自己來動手做料理，也讓麵包機、氣炸鍋等商品意外成了新寵兒，有台灣業者更是設計出自動蛋捲機，只要丟進雞蛋，就能自動做好一份日式蛋捲，號稱還擁有玉子燒的口感，算是懶人料理機，推出才短短2個月，不但全球熱銷5萬台，同類型的蛋捲機也跟著在網購通路熱銷，還登上百貨十大年度夯品。  香噴噴的玉子燒，家事達人親自示範，用高湯調味的蛋汁一層成形，翻動平底鍋，再包上一層，火侯得要拿捏得當，才能做出美味的日式蛋捲，但如果不擅長下廚，現在也有這種自動蛋捲機，熱水瓶大小，只留下直徑3公分小洞口，把蛋打成蛋汁倒入，蛋汁在瓶身內慢慢加熱，不斷冒泡，就怕只有蛋太單調，甚至還能塞進火腿肉。 業者黃先生：「內部食物已經熟了之後，它會依照內部氣壓，讓它把煮熟的食物自動推上來。」 利用熱脹冷縮原理，讓蛋捲自動成形，幾乎完全不用自己動手，號稱有日式玉子燒口感，我們把成品和老師手工作的玉子燒，請民眾試吃看看。記者：「比較喜歡哪一個？」民眾：「這個(蛋捲機做的)。」記者：「為什麼？」民眾：「因為蛋捲機做的比較Q。」 民眾：「這個(手工)比較綿密。」 手工做的層次分明，有綿密口感，蛋捲機做的口感Q滑，各有愛好者；事實上因為食安問題，有台灣業者自行研發蛋捲機，從上市至今，已經熱銷5萬台，而在網購通路，凡是叫蛋捲機的商品，都賣得嚇嚇叫，意外登上百貨十大年度夯品排行榜。 ,新聞,yahoo新聞 > 消費,主文,2013-12-30 19:53:00,0,0,TVBS,0.502,0.236,http://tw.news.yahoo.com/登百貨十大夯品-蛋捲機靠食安崛起-115300857.html
氣炸鍋|汽炸鍋|氣炸锅,請問,請問用氣炸鍋可以炸成酥脆的豬蹄膀嗎？,討論區,BabyHome 寶貝家庭親子網 > 閒聊專區,主文,2013-12-30 16:56:08,0,0,小永,0,0,http://www.babyhome.com.tw/mboard/topic.php?&bid=6&sID=4280226
氣炸鍋|汽炸鍋|氣炸锅,快樂腸病毒假,"腸病毒真的是每個父母最擔心的病,除了自己小朋友得病,著急不已外, 也會影響到全班的學習及父母的假!  記得之前妹妹的是肇事者,讓班上停過課,這次是受害者,不過是乎沒那麼糟~ 停課時,心想這次是要自己請假呢?還是回阿嬤家?  讓妹妹選,一下子要回去,一下子希望阿嬤來,一下子要跟我去上班...反覆不定! 最後,只好跟爸爸輪流請,在家真的很無聊,妹妹說還是上課得好~(老師ㄧ定很高興!) 陪他一個早上,她會一直找妳玩辦家家酒,玩牌,玩玩具... 就是這組公主系列,要玩公主生活...(ORZ...) 早上先做明天早餐,每次麵包出爐時間都是深夜,妹妹都沒機會玩到麵糰 這次就先讓她大顯身手一番! (早上起床還穿著公主外套,看起來很像貴婦在工作) 第一次發酵完,準備成型 很有架勢喔~ 好不容易有事做,做麵包一下子又沒事了,又要再陪她玩,看小書... 外面天氣不佳,又不好出去走走消耗體力,讓她自己玩,又覺得她很可憐~ 放假一點也不輕鬆! !!當下決定....找同學來陪她... 這還是有風險的,如果不小心其中一位小朋友淺伏期怎辦? 賭了!  下午兩點後,小朋友來了,各自都帶了玩具,其實這樣他們就可以玩了... 結果~~~我手也癢,又有周末採的草莓,就讓他們玩一下烘培吧~ 材料家裡都有,麵粉因用太兇了,早上就補貨10公斤,準備努力的做了~~ 要玩烘培,小朋友馬上分工合作加材料 小花說,妹妹要做機會很多,所以要讓她們先選,機會先給她們(好有主見!有leader才能~) 小花洗草苺 加麵粉,妹妹協助加幫忙看刻度 Candy切奶油,稱重(剛從冰箱拿出來,瞞難切的...真是辛苦她了!)  搞定食材後,就交給攪拌機進行攪拌及第一次發酵!  第一次發酵後,讓她們進行成型(像捏黏土~~),接著還要第二次發酵 完成第二次發酵,表面塗上蛋汁(很古溜~外觀似乎不太美) 烤好的成品,附帶一盤氣炸鍋薯條! 很幸福的感覺~~ 中場發酵時間還要消耗一些體力一下~ 下午茶時間~~strawberry pancake 自己煎餅--從小訓練烹煮,以後才不怕餓肚子！   擺上草苺,擠上幕斯~~ 好吃~~讚不絕口! 第二天~續攤 Candy媽媽接力,第一招:原本要去蠟藝館的,結果沒開門!（糗了！） 第二招:巨城溜直排輪去 全場只有她們倆 很快的就無聊不想玩了~(Candy媽媽當場傻眼了) 巨城內耶誕節應景裝飾,小朋友還蠻愛的~  Candy媽媽第三招:作沙畫  第四招:湯姆龍及小朋友的保齡球 其實,小朋友想去玩不外乎是要集小卡換禮物(一個得到印章,一個得到螢光筆) 午餐時間,給Candy媽媽請囉!妹妹原本就吃很慢,這次就辛苦Candy媽媽了~~ Candy媽媽快沒招了,只好回家想想辦法!! 哈哈哈!回家反而輕鬆,她們就能自己玩得很開心~~ 最後一招:巧虎及Sophia公主影集(Candy媽媽這時超輕鬆的!!可以翹角粘嘴鬚了) 玩到17:30了,還不想回家,都忘了晚上還要上她愛的畫畫課, 還好,老師這次重感冒請假,又讓她賺到留下玩的時間! 真是辛苦Candy媽媽了,打擾了一整天,還讓她送回來~~",部落格,PcHome部落格 > 最新文章,主文,2013-12-30 16:42:42,0,0,Jenny,0.478,0.495,http://mypaper.pchome.com.tw/cycjen/post/1326639763
氣炸鍋|汽炸鍋|氣炸锅,"上傳BB照片,就可以抽奶粉、氣炸鍋、新光三越禮券、慢磨機...","剛剛收到好叐的好康分享 我也才分享一下下 活動超簡單的 把拼圖拼好，再把小孩的照片上傳，填資料就能參加抽獎了 獎品有很豐富哦~可以參加看看 活動期間：12/18-1/31, 2/10就公布得獎名單哦. 給媽咪參考囉 http://gold.s26mama.com.tw  ",討論區,卡提諾王國 > 美滿家庭,主文,2013-12-30 15:57:00,2,180,Room78,0.558,0.204,http://ck101.com/thread-2894612-1-1.html
氣炸鍋|汽炸鍋|氣炸锅,烤石狗公(氣炸鍋),"上星期某人請老闆吃飯 老闆愛吃日式料理 自告奮勇幫某人安排~嘻,趁機楷點油 終於 吃到傳說台北第一好吃的烤魚-本多喜知次 皮脆肉多汁 得趁熱吃 再來口純米大吟釀 幸福啊 但某人不知忙什麼 只吃到冷掉的烤魚 沒法體驗這傳說中的美味 ' 假日天氣涼爽 去市場晃晃 看到石狗公 聽說是喜知次的兄弟 主婦沒錢買喜知次,也怕糟蹋食材 買條石狗公給某人加菜吧 ' 材料 1.石狗公 2.鹽 3.薑 ' 做法 1.清理魚鱗,魚頭和魚腹 2.餐巾紙吸乾水分,用薑片塗抹全身,再抹鹽,包覆保鮮膜放入冰箱冷藏 3.魚身用餐巾紙擦乾,兩面各畫兩刀,表面抹點油,放入氣炸鍋200度10分鐘,取出裝盤 ' 假日在家悠閒吃飯 紅甘,海鱺和鮭魚肚生魚片 再加上鹹滋滋鮭魚卵 某人很捧場吃光光 建議可用清蒸 ' 下次試試 魚身沾點粉 氣炸時間縮短到7分鐘",部落格,udn部落格 > 最多瀏覽,主文,2013-12-30 09:39:50,3,0,ritayang3399,0.505,0.4,http://blog.udn.com/ritayang3399/9515073
氣炸鍋|汽炸鍋|氣炸锅,各式家電商品百貨最低3.4折,太平洋SOGO百貨忠孝館將於12月31日至明年1月5日集結THOMSON、PHILIPS、Panasonic、TIGER、3M、HURON、迪朗奇、VORNADO、STAUB等品牌，推出「暖冬家電&德國雙人跨年特賣會」，祭出各式大小家電、廚房鍋具、家用雜貨等商品，折扣最低3.4折起，像是PHILIPS健康氣炸鍋皇家尊爵款，原價1萬6000元，特價1萬2900元，加贈智慧變頻電磁爐一台。 2014年1月1日、4日和5日特別推出超值競標活動，祭出原價4200至1萬7800元的小家電（福利品），指定商品最低起標價900元。以1月1日下午2時為例，推出PHILIPS三刀頭水洗電鬍刀（福利品）原價1萬5000元，起標價5000元、限5台。,新聞,聯合新聞網_子類群 > 折扣好康(消費資訊),主文,2013-12-30 03:59:00,0,0,聯合晚報╱本報訊,0.234,0.184,http://forum.udn.com/forum/NewsLetter/NewsPreview?NewsID=8393079&ch=rss_shopping
氣炸鍋|汽炸鍋|氣炸锅,"好康分享給大家~上傳寶寶照片就能抽""奶粉、iPad mini、氣炸鍋、新光三越禮券…""",2013的最後倒數第二天 分享一下~好友分享的~好康給大家囉!只要上網站把拼圖拼好，再把小孩的照片上傳，填資料就能參加抽獎了 獎品還真的很給力哦 有iPad mini、禮券、氣炸鍋等~媽咪可以參加看看http://gold.s26mama.com.tw/page/main.html,討論區,ISWII美妝新聞台 > 好康情報,主文,2013-12-30 00:00:00,4,0,Dulala,0.496,0.189,http://forum.iswii.net/forum/3/ftopic/11819
