監測主題,標題,內容,來源,來源網站,主文/回文,發佈時間,討論串總則數,點閱數,作者,正面強度,負面強度 ,原始連結
氣炸鍋|汽炸鍋|氣炸锅,PHILIPS城市系列DOWNTOWN時尚粉領頭戴式耳機SHL5605比較推薦,"PHILIPS城市系列DOWNTOWN時尚粉領頭戴式耳機SHL5605➽詳細官網資料※萱兒你看這個PHILIPS城市系列DOWNTOWN時尚粉領頭戴式耳機SHL5605。超讚的啦！我發現雅虎奇摩購物要比momo購物、金石堂書店更有競爭優勢。說實話，到處比價真的是很勞心勞力的一件事情，我就去搜尋、東森購物找很多的資訊！ (｡◕‿◕｡)敝人比較常上的網站是yahoo奇摩購物，其他goHappy購物、樂天市場、燦坤購物相比特價就少一些。科科科！凍北條要介紹給大夥入手囉！  點●官方介紹觀看更多推薦介紹資料。給瑋珊看也說這真的價格蠻合理的。前些日子看到的售價為3290元，網路售價隨時會調整,可以點擊商品圖片查看最新報價唷！  俺有去查找7Net購物以及pchome還有奇摩拍賣，但是價格都不像yahoo購物這樣的便宜!我從不負責任開箱文大概明瞭到這是◆支援Android手機(HTC等)、Apple手機，◆扁線防纏繞線材，◆公司貨一年保固，◆清甜人聲與高細節的音質。PHILIPS耳機/耳麥、最新PHILIPS DOWNTOWN商品。  無敵強的PHILIPS城市系列DOWNTOWN時尚粉領頭戴式耳機SHL5605-(銀/紫)支援Android手機(HTC等)、Apple手機清甜人聲與高細節的音質扁線防纏繞線材公司貨一年保固。 PHILIPS城市系列DOWNTOWN時尚粉領頭戴式耳機SHL5605❆觀看實物拍攝  網路購物是一種消費趨勢，可以方便找便宜東西，不定期買到低價東西，檢索譬如philips 7800mah,philips,philips dtd3190,philips氣炸鍋,philips刮鬍刀更完整找優惠商品 用百度找到了推薦文介紹PHILIPS城市系列DOWNTOWN時尚粉領頭戴式耳機SHL5605規格 商品名稱：PHILIP城市系列DOWNTOWN 商品型號：8SHL5605/98 商品規格：請見內容 生產地：中國  ➠進一步官網推薦介紹  ➽ PHILIPS耳機/耳麥 Philips SHG8000輕量式重低音電競耳機麥克風 2490元整雅虎購物簡單介紹信息◎震撼重低音給您絕佳聽覺感受,◎內縮式360度收音麥克風,◎輕量式頭帶設計長時配戴無負擔,◎耳罩音量控制設計輕鬆調節,◎公司貨 PHILIPS炫色耳塞式耳機SHE2640系列 299元整雅虎購物簡單介紹信息耳塞式設計,多種顏色供您挑選,雙通道平衡技術,強力釹磁鐵喇叭 PHILIPS後掛式線控耳機麥克風SHM6103 799元整雅虎購物簡單介紹信息◆32mm喇叭單元,◆靜音，音量可線控,◆可調式拉桿型麥克風,◆線長2m  PHILIPS個性繽紛密閉耳塞式電腦專用耳機麥克風SHM3700 749元整雅虎購物簡單介紹信息◆專為桌上電腦(PC)及筆記型電腦(NB)設計的,◆具備靜音控制的高敏感度麥克風,◆Combined-Plug設計,◆公司貨 PHILIPS超輕便全罩耳機SHP5401 869元整雅虎購物簡單介紹信息超輕量設計，零負擔,可調整式頭帶,亮白色面版，外型優雅,特殊材質耳墊，適合長時間使用 PHILIPS耳塞式耳機麥克風SHM3100U 399元整雅虎購物簡單介紹信息◆內置釹磁石驅動單元,◆搭載高感度麥克風,◆舒適材質耳塞式設計,◆公司貨 PHILIPS輕巧無負擔頭戴式耳機麥克風SHM7000 899元整雅虎購物簡單介紹信息◆柔軟耳機軟墊,◆插頭方便收納設計,◆高靈敏度的迷你麥克風 飛利浦PHILIPS Fidelio耳罩頭戴式耳機M1限量色(白/黑橘) 5490元整雅虎購物簡單介紹信息音效密閉式後方設計可有效隔離噪音,專為聲音精準度設計的雙層耳罩,頂級可透氣耳墊和記憶棉材質，配戴最服貼,線控麥克風，搭配接聽來電按鈕 Philips SHQ4017運動防水後掛式耳機/具智慧手機線控 1990元整雅虎購物簡單介紹信息◎強力低音立體聲讓您精神煥充沛,◎防水可沖洗設計不怕戶外弄髒,◎彈性頸帶與多尺寸耳套,◎輕鬆線控，音樂通話一手掌握,◎公司貨，一年保固    ",部落格,PcHome部落格 > PcHome BlogSearch搜尋結果,主文,2013-11-14 15:28:43,0,0,小瑄,0.458,0.221,http://mypaper.pchome.com.tw/padphone/post/1326190947
氣炸鍋|汽炸鍋|氣炸锅,超高畫質極致視界大同全新4K UHD智慧液晶系列智慧生活感受影像的真•湛•美,"超高畫質極致視界大同全新4K UHD智慧液晶系列智慧生活感受影像的真•湛•美 台灣家電龍頭品牌大同公司於今(11/13)由新任大同綜合訊電(大同3C)總經理張忠棋領軍舉辦「大同4K UHD智慧液晶系列上市記者會」，會中隆重發表大同全新4K UHD智慧液晶系列機種，強調極致非凡的4K超高解析度，同時結合智慧連網系統，提供消費者更高畫質的智慧生活；而為讓全民皆有能力享受高畫質的影像智慧生活，記者會中同時宣佈大同全新4K UHD智慧液晶系列將於11/14(四)起於大同3C黃金週中正式亮相，首批購買限量再享買大送小，提供給消費者最優惠的選擇。 大同綜合訊電(大同3C)總經理張忠棋表示，隨著數位時代的來臨，消費者對影像的需求與管道已不同以往，不論是電視頻道、網路視頻、手機等，消費者接受影像的來源愈來愈多、要求的影像品質自然也就愈來愈高階。但其實各種影像管道的發明皆是為了更加便利、智慧的生活。大同居於國產家電領導地位，有義務也有責任為消費者打造更加智慧便利的家電新體驗。【4K超高解析度、SCI大同獨家水晶色彩調校技術視野極限再放大】大同4K UHD智慧液晶系列具備超越800萬畫素的細膩畫質，卓越的影像表現相當於市面上FHD的4倍畫素規格，同時內建大同獨家水晶色彩影像技術(Superior Crystal Image，SCI)，可依當下情境調校出最適顯現色彩，讓影像更細膩、色彩更豐富，如同親眼所及真實視野，賦予影像畫面更真實、精湛的生命力。同4K UHD智慧TV 65/50吋上市免綁約並在黃金周推出多種回饋活動；右起綜合訊電總經理張忠棋與家電電子事業部副處長林嗣凱。(圖：大同提供)【Hybrid Home人性化介面四大介面設計智慧生活超easy】大同4K UHD智慧液晶系列以人性化體驗為出發點，全新打造Hybrid Home人性化介面，保留電視頻道影像與維持遙控器的使用習慣，將畫面呈現區分為四大介面：1.電視節目影像畫面格，讓在操作網路資訊的同時也不錯過精彩節目盛事，而16:9的最適觀賞黃金比例，讓消費者看得輕鬆自在無負擔。2.智慧新聞精選列表，讓你在觀賞節目空檔之時可即時掌握天下大事。3.我的最愛App捷徑列，可依消費者使用習慣自行設定專屬捷徑，提升便利並大幅減少操作時間，追求最佳使用者體驗。4.即時氣候資訊，隨時掌握氣候變化，讓出門穿衣不再為麻煩天氣傷腦筋。【多屏智慧影像分享隨時隨地同步分享精彩內容】大同4K UHD智慧液晶系列具備多屏智慧影像分享功能(Smart Remote 2nd Screen)，透過專屬的智慧遙控器App操作，將影像同步於平板電腦與智慧手機中，無論於任何背景情境下皆能同步享受影像畫面，並可透過平板或手機同步搖控，不再因事錯過任何精彩畫面，完美實現第二螢幕的理想境界。同時可自行選購搭配具備Touch Pad與QWERTY鍵盤的智慧遙控器，讓文字輸入搜尋更方便，滿足多元化使用模式。【影像雲端傳輸頻道同步共享生活樂趣】大同4K UHD智慧液晶系列內建“口袋碟“家庭雲端相薄頻道，利用雲端技術同步傳輸影像內容，可與世界各處的朋友、家人無縫分享照片與影片，打開螢幕即可一同感受生活中更多的溫馨、幸福時刻。【高質感髮絲紋窄細邊框極致美感新視界】大同4K UHD智慧液晶系列外觀設計採用高質感髮絲紋造型，搭配銀白色金屬美型窄細邊框，沉穩、大器，低調中不容忽視的注目感；底座同質感一體成型，精雕細琢下彷若家中藝術品般、精.湛•美。大同4K UHD智慧液晶系列共推出65型(UH6500)與50型(UH5000)兩款，同時間一併推出具備FHD高畫質的大同智慧液晶系列，分有50型(UA5000)與39型(UA3900)兩款，提供給消費者更多元化的高畫質智慧影像新享受。全新4K UHD智慧液晶首批限量買大送小大同3C黃金週搶先開賣滿額再送超級刮刮樂豐富大獎等你來拿本年度最後一檔、大同3C黃金週11/14(四)~11/20(三)於全台240間門市正式起跑囉！多項超值精選商品旋風下殺超低優惠，限時一週，錯過可惜；同時推出「超級刮刮樂」活動，活動期間會員來店消費單筆發票消費滿1000元，即送刮刮卡1張、滿3000元送4張、滿5000元送6張(最多送6張)，最高可得大同全新4K UHD智慧液晶(65型)，更有新HTC ONE(16GB)、大同智慧AI電鍋、大同氣炸鍋、富士instax mini 7S拍立得等多達30000多個獎項要送給大同3C尊貴粉絲們。同時，大同全新4K UHD智慧液晶系列將於大同3C黃金週搶先開賣。張總經理表示，全新4K UHD智慧液晶系列產品為大同旗下首款超高解析度4K顯示器，畫質精緻細膩，並帶入人性化體驗，賦予智慧連網功能。同時更重要的是，此次大同3C黃金週的開賣優惠活動就是希望提供給消費者的是最親民的價格、最貴族的享受，讓全民皆有能力享受影像世代的進步。大同全新4K UHD智慧液晶系列共推出65型(UH6500)與50型(UH5000)兩款，免綁約、立即現享上市優惠價。65型4K UHD智慧液晶首批上市價99,900元，50型4K UHD智慧液晶首批上市價49,900元，買就再享“買大送小“超值優惠：消費者凡於大同3C黃金週期間購買首批全新4K UHD智慧液晶系列商品，買就送市價約1萬元的32吋LED液晶顯示器(數量有限，送完為止)。消費者要大要小皆可一次滿足。<同場加映>大同3C黃金週再推強檔-大同48型多媒體LED液晶顯示器(V48R300)，擁有FHD高解析度及大同獨家水晶色彩影像技術(SCI)，讓影像更加亮麗、清晰；而窄邊框造型設計使得邊框尺寸大輻減少50%以上，帶來“大“螢幕的視覺效果。大同48型多媒體LED液晶顯示器(V48R300)原價24,900元，黃金週會員優惠價17,988元。 Data Sourcing :大同綜合訊電媒體行銷部",部落格,PcHome部落格 > PcHome BlogSearch搜尋結果,主文,2013-11-14 01:30:15,0,0,KIKO,0.532,0.424,http://mypaper.pchome.com.tw/kilayko26/post/1326186310
氣炸鍋|汽炸鍋|氣炸锅,超高畫質極致視界大同全新4K UHD智慧液晶系列智慧生活感受影像的真•湛•美," 超高畫質極致視界大同全新4K UHD智慧液晶系列智慧生活感受影像的真•湛•美 台灣家電龍頭品牌大同公司於今(11/13)由新任大同綜合訊電(大同3C)總經理張忠棋領軍舉辦「大同4K UHD智慧液晶系列上市記者會」，會中隆重發表大同全新4K UHD智慧液晶系列機種，強調極致非凡的4K超高解析度，同時結合智慧連網系統，提供消費者更高畫質的智慧生活；而為讓全民皆有能力享受高畫質的影像智慧生活，記者會中同時宣佈大同全新4K UHD智慧液晶系列將於11/14(四)起於大同3C黃金週中正式亮相，首批購買限量再享買大送小，提供給消費者最優惠的選擇。 大同綜合訊電(大同3C)總經理張忠棋表示，隨著數位時代的來臨，消費者對影像的需求與管道已不同以往，不論是電視頻道、網路視頻、手機等，消費者接受影像的來源愈來愈多、要求的影像品質自然也就愈來愈高階。但其實各種影像管道的發明皆是為了更加便利、智慧的生活。大同居於國產家電領導地位，有義務也有責任為消費者打造更加智慧便利的家電新體驗。 【4K超高解析度、SCI大同獨家水晶色彩調校技術視野極限再放大】 大同4K UHD智慧液晶系列具備超越800萬畫素的細膩畫質，卓越的影像表現相當於市面上FHD的4倍畫素規格，同時內建大同獨家水晶色彩影像技術(Superior Crystal Image，SCI)，可依當下情境調校出最適顯現色彩，讓影像更細膩、色彩更豐富，如同親眼所及真實視野，賦予影像畫面更真實、精湛的生命力。 大同4K UHD智慧液晶系列 【Hybrid Home人性化介面四大介面設計智慧生活超easy】  大同4K UHD智慧液晶系列 大同4K UHD智慧液晶系列以人性化體驗為出發點，全新打造Hybrid Home人性化介面，保留電視頻道影像與維持遙控器的使用習慣，將畫面呈現區分為四大介面：1.電視節目影像畫面格，讓在操作網路資訊的同時也不錯過精彩節目盛事，而16:9的最適觀賞黃金比例，讓消費者看得輕鬆自在無負擔。2.智慧新聞精選列表，讓你在觀賞節目空檔之時可即時掌握天下大事。3.我的最愛App捷徑列，可依消費者使用習慣自行設定專屬捷徑，提升便利並大幅減少操作時間，追求最佳使用者體驗。4.即時氣候資訊，隨時掌握氣候變化，讓出門穿衣不再為麻煩天氣傷腦筋。【多屏智慧影像分享隨時隨地同步分享精彩內容】大同4K UHD智慧液晶系列具備多屏智慧影像分享功能(Smart Remote 2nd Screen)，透過專屬的智慧遙控器App操作，將影像同步於平板電腦與智慧手機中，無論於任何背景情境下皆能同步享受影像畫面，並可透過平板或手機同步搖控，不再因事錯過任何精彩畫面，完美實現第二螢幕的理想境界。同時可自行選購搭配具備Touch Pad與QWERTY鍵盤的智慧遙控器，讓文字輸入搜尋更方便，滿足多元化使用模式。 【影像雲端傳輸頻道同步共享生活樂趣】大同4K UHD智慧液晶系列內建“口袋碟“家庭雲端相薄頻道，利用雲端技術同步傳輸影像內容，可與世界各處的朋友、家人無縫分享照片與影片，打開螢幕即可一同感受生活中更多的溫馨、幸福時刻。 【高質感髮絲紋窄細邊框極致美感新視界】大同4K UHD智慧液晶系列外觀設計採用高質感髮絲紋造型，搭配銀白色金屬美型窄細邊框，沉穩、大器，低調中不容忽視的注目感；底座同質感一體成型，精雕細琢下彷若家中藝術品般、精湛•美型。 大同4K UHD智慧液晶系列共推出65型(UH6500)與50型(UH5000)兩款，同時間一併推出具備FHD高畫質的大同智慧液晶系列，分有50型(UA5000)與39型(UA3900)兩款，提供給消費者更多元化的高畫質智慧影像新享受。 本年度最後一檔、大同3C黃金週11/14(四)~11/20(三)於全台240間門市正式起跑囉！多項超值精選商品旋風下殺超低優惠，限時一週，錯過可惜；同時推出「超級刮刮樂」活動，活動期間會員來店消費單筆發票消費滿1000元，即送刮刮卡1張、滿3000元送4張、滿5000元送6張(最多送6張)，最高可得大同全新4K UHD智慧液晶(65型)，更有新HTC ONE(16GB)、大同智慧AI電鍋、大同氣炸鍋、富士instax mini 7S拍立得等多達30000多個獎項要送給大同3C尊貴粉絲們。同時，大同全新4K UHD智慧液晶系列將於大同3C黃金週搶先開賣。張總經理表示，全新4K UHD智慧液晶系列產品為大同旗下首款超高解析度4K顯示器，畫質精緻細膩，並帶入人性化體驗，賦予智慧連網功能。同時更重要的是，此次大同3C黃金週的開賣優惠活動就是希望提供給消費者的是最親民的價格、最貴族的享受，讓全民皆有能力享受影像世代的進步。大同全新4K UHD智慧液晶系列共推出65型(UH6500)與50型(UH5000)兩款，免綁約、立即現享上市優惠價。65型4K UHD智慧液晶首批上市價99,900元，50型4K UHD智慧液晶首批上市價49,900元，買就再享“買大送小“超值優惠：消費者凡於大同3C黃金週期間購買首批全新4K UHD智慧液晶系列商品，買就送市價約1萬元的32吋LED液晶顯示器(數量有限，送完為止)。消費者要大要小皆可一次滿足。<同場加映>大同3C黃金週再推強檔-大同48型多媒體LED液晶顯示器(V48R300)，擁有FHD高解析度及大同獨家水晶色彩影像技術(SCI)，讓影像更加亮麗、清晰；而窄邊框造型設計使得邊框尺寸大輻減少50%以上，帶來“大“螢幕的視覺效果。大同48型多媒體LED液晶顯示器(V48R300)原價24,900元，黃金週會員優惠價17,988元。 大同多媒體LED液晶顯示器V48R300、V40R300    ",部落格,PcHome部落格 > PcHome BlogSearch搜尋結果,主文,2013-11-13 20:01:04,0,0,YOYO,0.528,0.425,http://mypaper.pchome.com.tw/026955/post/1326185055
氣炸鍋|汽炸鍋|氣炸锅,Philips飛利浦42吋Smart LED液晶顯示器+視訊盒(42PFL6008)價格推薦,"阿哈！我最終buy下去Philips飛利浦42吋Smart LED液晶顯示器+視訊盒(42PFL6008)了！Philips飛利浦42吋Smart LED液晶顯示器+視訊盒(42PFL6008)➤詳細推薦介紹※刷指定滿萬送仟金▼送藍光播放機+2禮這麼優惠實在好咖心吶爆強的。我發現奇摩購物中心要比露天拍賣以及24H購物更有競爭力。超多的部落客很都說Philips飛利浦42吋Smart LED液晶顯示器+視訊盒(42PFL6008)爆讚的！去找了各種開箱文、官網報導，這個超猛的折扣價真的非常物超所值，有可能會被秒殺一空，心動要快！當前像是goHappy購物、樂天市場、燦坤購物都有販賣該Philips商品!Philips 42 Smart LED 42PFL6008唷呼。  前陣子看到的價格是22880元，網購是一種消費趨勢，可以方便找價格實惠商品，不定期買到低價東西，網路售價隨時會異動,可以點擊商品圖片查看即時價格唷！點這看yahoo奇摩購物更詳盡信息!  現今網路購物市場很激烈，雅虎購物、7Net購物、博客來都是我比較常去逛的線上購物，經常有打折商品。我從推薦文大概明白到這是刷指定滿萬送仟金▼送藍光播放機+2禮■100HzPMR完美動態比率標準，■送安裝+預購好禮，■LiTV智慧連網平台，■極薄邊框，極致智慧，■內附4G隨身碟及無線網卡。其他品牌電視、可上網電視專區、網路電視、液晶電視尺吋42吋電視、HD 1080P電視尺吋42吋電視、數位電視、 LED 40吋以上電視、PHILIPS飛利浦電視、最新Philips 42商品。  爆殺的Philips飛利浦42吋Smart LED液晶顯示器+視訊盒(42PFL6008) 2013/10/18陸績出貨，預購好禮送：1.贈LiTV三年加值型服務(KOD卡拉ok +VOD家庭電影院)2.原三年保固加碼升級為五年全機保固3.贈飛利浦USB/MP3 DVD播放機(DVP3650K)商品特色◎極薄邊框，極致智慧◎LiTV智慧連網平台◎Full HD高畫質1920 x 1080p◎Pixel Plus HD真實生動的影像顯示◎100HzPMR完美動態比率標準◎創新立體音訊技術◎智慧節能功能◎內建三組HDMI數位影音端子◎內建三組USB端子支援多媒體播放◎含類比/數位視訊盒◎三年原廠保固服務◎內附一支4G隨身碟(家庭娛樂平台用)/一支無線網卡。 Philips飛利浦42吋Smart LED液晶顯示器+視訊盒(42PFL6008)➤實物隨手拍  給詩婷看也說這真的報價蠻合理的。搜索例如philips 7800mah,philips氣炸鍋,philips,philips dtd3190,philips刮鬍刀更進一步找便宜東西 用yahoo搜尋找到了不負責任開箱文介紹Philips飛利浦42吋Smart LED液晶顯示器+視訊盒(42PFL6008)規格  ◎產地：台灣 ◎保固：三年 ◎若有搭贈贈品，贈品於鑑賞期後寄出，店家有保留活動、贈品變更之權利。  ◎本產品文案、規格為原廠所提供，若有變動敬請參照實際商品為準。型號42PFL6008畫面/顯示顯示器LED Full HD對角畫面尺寸(吋) 42吋面板解析度1920 x 1080p長寬比16:9亮度350cd/m²畫面增強Pixel Plus HD智慧互動智能連網功能YES韌體可升級可透過USB升級的韌體螢幕格式調整4:3，16:9，縮放比1，縮放比2音效輸出功率(RMS) 20W(2 X 10W)加強音效自動音量調整器，清晰音效連線HDMI連接頭數量3色差端子數量1(可接AV端子) USB數量3其他連接PC，VGA輸入，電腦音源輸入端子，音訊輸入左/右，耳機輸出RJ4S網路接口，SPDIF光纖輸出端子，麥克風輸入端子，AV+R/L影音輸出端子多媒體應用程式影片播放格式AVI，MKV，MPEG-4，MPEG1，MPEG2，H264，WMV，RM，RMVB，MP4音樂播放格式MP3圖片播放格式JEPG支援的螢幕解析度電腦輸入高達1920x1080@60Hz視訊輸入24 60Hz高達1920x1080p視訊影像處理功能支援NTSC與數位DVB-T訊號接收YES電源主電源AC 110V 60Hz環境溫度5°C至40°C待機消耗功率<0.5瓦省電功能自動關閉計時器耗電量98W配件附配件桌上型立架，快速入門指南，法律和安全手冊，保證手冊，使用者手冊設備尺寸(不含機座)(寬X深X高mm) 957.2 x 37.3 x 572.7 mm設備尺寸(含機座)(寬X深X高mm) 957.2 x 236 x 622.9 mm產品重量11.5kg產品重量(+機座) 14.2kg產品含包裝重量17.2kg相容壁掛架400 x 400 mm   ▶▶更精闢推薦介紹資料  ★其他品牌電視 Philips飛利浦46吋Smart LED液晶顯示器+視訊盒(46PFL6008) 33980元整雅虎奇摩購物說明資訊■送安裝+預購好禮,■極薄邊框，極致智慧,■LiTV智慧連網平台,■100Hz PMR完美動態比率標準,■內附4G隨身碟及無線網卡 Kolin歌林55吋FHD LED液晶顯示器+視訊盒(KLT-55E01) 29900元整雅虎奇摩購物說明資訊1920×1080高解析度,IPS面板,數位電視錄影(須格式化隨身碟),窄邊框鋼琴烤漆,無線數位/Hi-HD接收 Kolin歌林42吋FHD LED連網液晶顯示器(KLT-42EP01) 15900元整雅虎奇摩購物說明資訊1920x1080高解析度,支援Android系統連網,支援數位電視錄影,支援無線數位/Hi-HD接收,3D數位梳型濾波器,隨貨附贈視訊盒(KTVB-HD02)  DECAMAX 26吋Full HD液晶顯示器+類比視訊盒(DM-26CP) 5888元整雅虎奇摩購物說明資訊1920 X 1200高解析度,三組HDMI輸入端子,USB影片、音樂、圖片播放,全機一年保固,本商品不含安裝 Philips飛利浦42吋Smart LED液晶顯示器+視訊盒(42PFL6008) 21880元整雅虎奇摩購物說明資訊極薄邊框，極致智慧,LiTV智慧連網平台,100Hz PMR完美動態比率標準,內附4G隨身碟及無線網卡 Philips飛利浦46吋Smart LED液晶顯示器+視訊盒(46PFL6008) 34378元整雅虎奇摩購物說明資訊■送安裝+預購好禮,■極薄邊框，極致智慧,■LiTV智慧連網平台,■100Hz PMR完美動態比率標準,■內附4G隨身碟及無線網卡 Philips飛利浦46吋Smart LED液晶顯示器+視訊盒(46PFL6008) 32880元整雅虎奇摩購物說明資訊■送安裝+預購好禮,■極薄邊框，極致智慧,■LiTV智慧連網平台,■100Hz PMR完美動態比率標準,■內附4G隨身碟及無線網卡 [結帳再折]Kolin歌林55吋FHD LED液晶顯示器+視訊盒(KLT-55E01) 29900元整雅虎奇摩購物說明資訊1920×1080高解析度,IPS面板,數位電視錄影(須格式化隨身碟),窄邊框鋼琴烤漆,無線數位/Hi-HD接收 Philips飛利浦50吋Smart LED液晶顯示器+視訊盒(50PFL6008) 42378元整雅虎奇摩購物說明資訊■送安裝+預購好禮,■極薄邊框，極致智慧,■LiTV智慧連網平台,■100Hz PMR完美動態比率標準,■內附4G隨身碟及無線網卡      ",部落格,PcHome部落格 > PcHome BlogSearch搜尋結果,主文,2013-11-13 12:52:48,0,0,允瑤,0.429,0.289,http://mypaper.pchome.com.tw/vjqk5425/post/1326182184
氣炸鍋|汽炸鍋|氣炸锅,"今天收到遠百寄來的3件氣炸鍋,馬上就成功做出小孩也愛吃的""...","今天收到遠百寄來的3件氣炸鍋,馬上就成功做出小孩也愛吃的""健康薯條"",皮是玉堯玉舜削的,我們都覺得很有成就感.用氣炸鍋可以做出無油炸健康薯條(我還是要有加一點油拌一拌比較好吃,但不用油炸是氣炸)無油煙省油方便又可減少百分之80的油脂攝取,我覺得老人很容易有心血管問題,所以也幫小孩的奶奶與外婆各買了1台,昨天荷包大失血,但為了家人健康是值得的.",社群網站,Facebook公眾訊息 > FbPublicMsg,主文,2013-11-13 12:27:36,8,25,陳芬香,0,0,http://www.facebook.com/permalink.php?story_fbid=696252223726259&id=100000244628109
氣炸鍋|汽炸鍋|氣炸锅,全國電社區園遊會15日登場,（中央社記者羅秀文台北13日電）由全國電子主辦的社區園遊會，15日晚間7時將在新北市新店區福德宮及屏東縣萬丹鄉新興國小同步登場，現場舉辦美食饗宴、公益拍賣、家電知識分享等活動，與鄉親同樂。 全國電子表示，「當我們同在一起社區園遊會」現場準備氣炸鍋、厚釜鍋、豆漿機等小家電，製作美食供鄉親嚐鮮。 現場將抽出幸運民眾，贈送「小家電終身免費維修」金幣貼紙，獲獎民眾可享有小家電終身免費維修服務。 此外，全國電子現場將捐出數項小家電，由社區鄉親競標搶便宜，現場拍賣所得將全數捐給在地社區，作為社區發展基金。1021113,新聞,MSN新聞 > 財經新聞,主文,2013-11-13 09:28:00,0,0,中央社,0.56,0.138,http://news.msn.com.tw/./news3425614.aspx
