監測主題,標題,內容,來源,來源網站,主文/回文,發佈時間,討論串總則數,點閱數,作者,正面強度,負面強度 ,原始連結
氣炸鍋,忙裡偷閒也能當煮婦。全靠這飛利浦智慧萬用鍋HD2175！(拍),... 就跟飛利浦氣炸鍋一樣 都還沒開始使用就被fb朋友燒的體無完膚 我終於也收到飛利浦智慧萬用鍋了........(雙手點肩嘴裡搭〔喔耶〕同時把手高舉)不囉嗦！ 懶人食譜直接...,討論區,開箱王 > 食品與料理,主文,2013-12-27 12:46:00,0,60,凱莉,0.482,0.445,http://gounboxing.com/article-9480-1.html
氣炸鍋,上傳BB照片，便可登站參加抽獎....奶粉、氣炸鍋、新光三越禮券...等,登站還蠻快蠻容易的 希望中個ipad mini也一樣容易 叫老公也登一下再中個奶粉也不賴XDDD,討論區,SOGO論壇 > 寶貝生活館,回文,2013-12-27 09:16:23,3,50,JAVA,0.604,0,http://oursogo.com/thread-1628992-1-1.html
氣炸鍋,酥炸蝴蝶鮸魚(氣炸鍋),...沒法直接放入氣炸鍋 烤箱只烤一隻魚 有點浪費 想到 之前做過蝴蝶雞~去除雞背大骨 那來做個蝴蝶魚 這樣就可進小小的氣炸內鍋 ' 材料 1.鮸魚 2...,部落格,udn部落格 > 最多推薦,主文,2013-12-27 09:03:15,3,0,ritayang3399,0.416,0.436,http://blog.udn.com/ritayang3399/10158839
氣炸鍋,"我用氣炸鍋來炸豬油,好乾淨,好方便","以為賣8990原來更便宜,炸鍋愛用家族就是我,現在鹹酥雞都麻家裡做就好比較健康安心http://www.babyhome.com.tw/bbgo/product.php?pid=19036",討論區,BabyHome 寶貝家庭親子網 > 閒聊專區,回文,2013-12-27 08:57:33,20,0,祐子mom,0.73,0.211,http://www.babyhome.com.tw/mboard/topic.php?page=2&&bid=6&sID=4241878
氣炸鍋,"我用氣炸鍋來炸豬油,好乾淨,好方便","以為賣8990原來更便宜,炸鍋愛用家族就是我,現在鹹酥雞都麻家裡做就好比較健康安心http://www.babyhome.com.tw/bbgo/product.php?pid=19036",討論區,BabyHome 寶貝家庭親子網 > 香香美食,回文,2013-12-27 08:57:33,20,0,祐子mom,0.73,0.211,http://www.babyhome.com.tw/mboard/topic.php?page=2&&bid=13&sID=4241878
氣炸鍋,數字看零售,...而「氣炸鍋」（5.97％）及「慢磨/果汁機」（3.48％）等擠進上班族最想要的抽獎禮品前10名，顯見上班族健康意識逐漸抬頭，讓健康食品小家電成為尾牙夢幻逸品之一...,新聞,yahoo新聞 > 消費,主文,2013-12-27 05:30:00,0,0,中時電子報,0.492,0.189,http://tw.news.yahoo.com/數字看零售-213000529.html
氣炸鍋,數字看零售,...而「氣炸鍋」（5.97％）及「慢磨／果汁機」（3.48％）等擠進上班族最想要的抽獎禮品前10名，顯見上班族健康意識逐漸抬頭，讓健康食品小家電成為尾牙夢幻逸品之一...,新聞,工商時報 > 產業．科技,主文,2013-12-27 04:10:00,0,0,工商時報 方明,0.488,0.188,http://www.chinatimes.com/newspapers/20131227000300-260204
氣炸鍋,【按讚+留言★抽飛利浦沙龍級負離子SPA按摩吹風機HP82...,... http://www.momoshop.com.tw/goods/GoodsDetail.jsp?i_code=1533594&cid=fb1225&oid=1530另外，折到往生價的飛利浦氣炸鍋<...,社群網站,facebook粉絲團 > momo富邦購物網,主文,2013-12-26 16:08:52,572,4204,momo富邦購物網,0.537,0.179,http://www.facebook.com/permalink.php?story_fbid=10152080435178431&id=165449553430
氣炸鍋,上傳BB照片，便可登站參加抽獎....奶粉、氣炸鍋、新光三越禮券...等,謝謝謝謝分享!!所有的獎品都好想要哦...,討論區,SOGO論壇 > 寶貝生活館,回文,2013-12-26 11:44:09,3,50,arkc,0.766,0,http://oursogo.com/thread-1628992-1-1.html
氣炸鍋,上傳BB照片，便可登站參加抽獎....奶粉、氣炸鍋、新光三越禮券...等,感謝分享！！！！！ 參加了～ 希望可以抽到氣炸鍋XD,討論區,SOGO論壇 > 寶貝生活館,回文,2013-12-26 10:11:24,3,50,bobobox,0.294,0,http://oursogo.com/thread-1628992-1-1.html
氣炸鍋,聖誕搜集趣,水晶球在特賣-氣炸鍋,討論區,BabyHome 寶貝家庭親子網 > 閒聊專區,回文,2013-12-25 17:06:54,10,0,邁入歐吉桑階段,0,0,http://www.babyhome.com.tw/mboard/topic.php?&bid=6&sID=4278087
氣炸鍋,PHILIPS Fidelio S1耳塞式耳機+SHL9705A頭戴式耳機超值好禮價格推薦,"... 去找了各種開箱文、官網報導，查找比如philips,philips dtd3190,philips氣炸鍋,philips 7800mah,philips刮鬍刀進一步找價格實惠商品<B...",部落格,PcHome部落格 > PcHome BlogSearch搜尋結果,主文,2013-12-25 15:42:20,0,0,小花喵,0.485,0.351,http://mypaper.pchome.com.tw/galaxys4/post/1326582549
氣炸鍋,聲寶保溫盤(KM-L1015WL) ♣將調回原價♣,...售價:2980  PT-300g多用途電子湯匙秤 售價:350 ◎單位選擇克/盎司◎重量鎖定、電量不足顯示◎省電關機、超重顯示 歌林kolin-健康無油空氣炸鍋-NJ...,部落格,udn部落格 > UDN BlogSearch搜尋結果,主文,2013-12-25 11:55:56,0,0,c1yy22o0,0.429,0.209,http://blog.udn.com/c1yy22o0/10135799
氣炸鍋,聲寶保溫盤(KM-L1015WL) ♥省很多♥,... 歌林電動塔吉鍋KHL-LN0501  售價:1488 蒸氣循環燜煮100%保留原味簡單烹煮更省電煙囪式造型強化玻璃蓋，烹煮一目了然 歌林kolin-健康無油空氣炸鍋-N...,部落格,udn部落格 > UDN BlogSearch搜尋結果,主文,2013-12-25 11:43:05,0,0,y2191wf,0.453,0.205,http://blog.udn.com/y2191wf/10135592
氣炸鍋,【魚乾】小廚房-聽起來就很厲害[烤雞腿排佐馬鈴薯泥],如果自家烤箱不夠大的話可以用氣炸鍋嗎?﻿,社群網站,Youtube最多人喜歡 > DIY教學,回文,2013-12-25 11:26:01,291,19688,李家穎,0,0,http://www.youtube.com/all_comments?v=iBxpCd_qPkk
氣炸鍋,"我用氣炸鍋來炸豬油,好乾淨,好方便","白金氣炸鍋功能更強呢！ 送的烤盤,食譜滿需要的 我也準備buy一個",討論區,BabyHome 寶貝家庭親子網 > 香香美食,回文,2013-12-25 09:05:54,20,0,我不累我不累,0,0,http://www.babyhome.com.tw/mboard/topic.php?page=2&&bid=13&sID=4241878
氣炸鍋,"我用氣炸鍋來炸豬油,好乾淨,好方便","白金氣炸鍋功能更強呢！ 送的烤盤,食譜滿需要的 我也準備buy一個",討論區,BabyHome 寶貝家庭親子網 > 閒聊專區,回文,2013-12-25 09:05:54,20,0,我不累我不累,0,0,http://www.babyhome.com.tw/mboard/topic.php?page=2&&bid=6&sID=4241878
氣炸鍋,曾愷玹停工養胎公婆疼最後一撈遮肚搶200萬,...」 曾愷玹代言飛利浦家電廣告2年，進帳200萬元，本月17日她進棚連拍2天氣炸鍋、電鍋等廣告，這是她休息前最後1個工作，陳冠宇事先交待經紀人賴盛芳要注意她安全，她出入休息室都有人扶著...,新聞,蘋果日報 > 娛樂總覽,主文,2013-12-25 00:00:00,0,0,張瑞振、葉婉如台北報導,0.522,0.221,http://www.appledaily.com.tw/appledaily/article/entertainment/20131225/35530771
氣炸鍋,【星羽是吃貨-宅配】口味多元，酥脆口感讓人一口接一口停不下來~鯨宴時尚。,... 5.把準備好的豬柳條放到氣炸鍋裡，不用抹油，190度炸7分鐘，約4分鐘翻面。 6.準備自己喜歡吃的醬料，炸好就可以吃囉~~     星羽這次是用walia哇哩嘞果仁脆片...,討論區,iPeen愛評網 > 最新文章,主文,2013-12-24 18:04:02,14,77,星羽,0.546,0.401,http://www.ipeen.com.tw/comment/587920
氣炸鍋,Re: [求助]婆婆的期待，媳婦做不到,"...^^^^^^^^^^^^^^^^^^^^^^^^^^^^^^^^^^^^^^^^^^^^這都是要花時間精進的市面上有些簡單食譜,用電鍋微波爐就可以搞定的好一點的廚具(氣炸鍋,甚至貴死人的...",社群網站,Ptt > marriage,主文,2013-12-24 13:43:42,3,0,mayko,0.165,0.439,http://www.ptt.cc/bbs/marriage/M.1387863825.A.1D4.html
氣炸鍋,2013網購消費指標！滅蟑尬面膜威化捲成為零食新寵,"...網友也愛日系家電像SONY、日立、Panasonic等，以電視、清淨機、洗衣機這些高單價大型家電；近期DIY家電銷售也正夯,像麵包機、榨油機、氣炸鍋、攪拌器等廚房小家電也是家庭主婦的最愛...",新聞,華視新聞 > 生活新聞,主文,2013-12-24 12:11:00,0,0,記者彭夢竺／台北報導,0.497,0.224,http://news.cts.com.tw/nownews/life/201312/201312241355585.html
氣炸鍋,2013網購消費指標！滅蟑尬面膜威化捲成為零食新寵,"...網友也愛日系家電像SONY、日立、Panasonic等，以電視、清淨機、洗衣機這些高單價大型家電；近期DIY家電銷售也正夯,像麵包機、榨油機、氣炸鍋、攪拌器等廚房小家電也是家庭主婦的最愛...",新聞,Hinet > 生活新聞,主文,2013-12-24 12:11:00,0,0,NOWnews,0.496,0.223,http://times.hinet.net/news/14948143?m=cl
氣炸鍋,2013網購消費指標！滅蟑尬面膜威化捲成為零食新寵,"...網友也愛日系家電像sony、日立、panasonic等，以電視、清淨機、洗衣機這些高單價大型家電；近期DIY家電銷售也正夯,像麵包機、榨油機、氣炸鍋、攪拌器等廚房小家電也是家庭主婦的最愛...",新聞,Sina新聞 > 台灣生活,主文,2013-12-24 12:11:00,0,0,NOWnews今日新聞,0.498,0.224,http://news.sina.com.tw/article/20131224/11430428.html
氣炸鍋,2013網購消費指標！滅蟑尬面膜威化捲成為零食新寵,"...網友也愛日系家電像SONY、日立、Panasonic等，以電視、清淨機、洗衣機這些高單價大型家電；近期DIY家電銷售也正夯,像麵包機、榨油機、氣炸鍋、攪拌器等廚房小家電也是家庭主婦的最愛...",新聞,yahoo新聞 > 消費,主文,2013-12-24 12:11:00,0,0,NOWnews,0.496,0.223,http://tw.news.yahoo.com/2013網購消費指標-滅蟑尬面膜-威化捲成為零食新寵-041141977.html
氣炸鍋,[家常料理]戰鬥燒肉潛艇堡,用氣炸鍋烤肉片時，肉片有須翻面嗎？ 加點生菜再加點沙拉，超有吃美式潛艇堡的感覺...,討論區,伊莉討論區 > 美味食譜(飲食交流),回文,2013-12-24 12:09:00,17,1195,sweetellie62,0,0.206,http://www07.eyny.com/thread-9242769-1.html
氣炸鍋,"我用氣炸鍋來炸豬油,好乾淨,好方便","版媽有科學家的精神,不過炸多久比較好,還有油煙也要注意,如果油煙變成附著在內槽也是不好氣炸變成毒氣反而影響健康",討論區,BabyHome 寶貝家庭親子網 > 香香美食,回文,2013-12-24 09:57:32,20,0,陽光暖暖,0.587,0.281,http://www.babyhome.com.tw/mboard/topic.php?page=2&&bid=13&sID=4241878
氣炸鍋,"我用氣炸鍋來炸豬油,好乾淨,好方便","版媽有科學家的精神,不過炸多久比較好,還有油煙也要注意,如果油煙變成附著在內槽也是不好氣炸變成毒氣反而影響健康",討論區,BabyHome 寶貝家庭親子網 > 閒聊專區,回文,2013-12-24 09:57:32,20,0,陽光暖暖,0.587,0.281,http://www.babyhome.com.tw/mboard/topic.php?page=2&&bid=6&sID=4241878
氣炸鍋,"我用氣炸鍋來炸豬油,好乾淨,好方便","求分享白金款分享,過年要來年夜菜是惡夢氣炸鍋能炸魚嗎？http://www.babyhome.com.tw/bbgo/product.php?...",討論區,BabyHome 寶貝家庭親子網 > 香香美食,回文,2013-12-24 09:19:18,20,0,我不累我不累,0.288,0.278,http://www.babyhome.com.tw/mboard/topic.php?page=2&&bid=13&sID=4241878
氣炸鍋,"我用氣炸鍋來炸豬油,好乾淨,好方便","求分享白金款分享,過年要來年夜菜是惡夢氣炸鍋能炸魚嗎？http://www.babyhome.com.tw/bbgo/product.php?...",討論區,BabyHome 寶貝家庭親子網 > 閒聊專區,回文,2013-12-24 09:19:18,20,0,我不累我不累,0.288,0.278,http://www.babyhome.com.tw/mboard/topic.php?page=2&&bid=6&sID=4241878
氣炸鍋,20131221微醺廚房,"...給不吃生食的娟 ' 鹽麴豬頸肉佐柚子胡椒 用鹽麴醃一個星期 微甜鹹度適中~不沾醬就夠味 嘻~為什麼知道這味道,因為切完有偷偷吃邊角肉(抹嘴) ' 用氣炸鍋烤的...",部落格,udn部落格 > 最多瀏覽,主文,2013-12-24 08:58:32,4,0,ritayang3399,0.496,0.209,http://blog.udn.com/ritayang3399/10091310
氣炸鍋,抗漲網上箱購日用品賣翻,... 食安問題連環爆，今年網購爆紅商品就屬「DIY家電」，PChome 24h購物DIY家電成長50％，其中製麵包機最熱賣成長達80％以上，momo購物慢磨機、氣炸鍋與製麵包機銷量都是去...,新聞,聯合新聞網_子類群 > 折扣好康(消費資訊),主文,2013-12-24 01:02:00,0,0,聯合報╱記者林佳儀╱台北報導,0.474,0.424,http://forum.udn.com/forum/NewsLetter/NewsPreview?NewsID=8379933&ch=rss_shopping
氣炸鍋,2013網購消費指標！滅蟑尬面膜威化捲成為零食新寵,"...網友也愛日系家電像SONY、日立、Panasonic等，以電視、清淨機、洗衣機這些高單價大型家電；近期DIY家電銷售也正夯,像麵包機、榨油機、氣炸鍋、攪拌器等廚房小家電也是家庭主婦的最愛...",新聞,MSN新聞 > 生活新聞,主文,2013-12-24 00:42:00,0,0,NOWnews,0.496,0.223,http://news.msn.com.tw/./news3490750.aspx
氣炸鍋,"蝦咪,想訂個烤地瓜竟然要排到4~5天後",有烤箱、氣炸鍋的話 買地瓜回來洗乾淨，扔進去烤個30分鐘 東西只要是熱的就好吃 外面地瓜賣的實在是太貴了........,討論區,PCDVD > 七嘴八舌異言堂,回文,2013-12-23 23:27:00,21,0,raintchen,0.568,0.294,http://www.pcdvd.com.tw/showthread.php?page=2&t=1034577
氣炸鍋,上傳BB照片，便可登站參加抽獎....奶粉、氣炸鍋、新光三越禮券...等,...獎品有...奶粉、iPad mini、氣炸鍋、新光三越禮券…… 附上活動網址 http://gold.s26mama.com.tw/page/main.html 我也參加了~...,討論區,SOGO論壇 > 寶貝生活館,主文,2013-12-23 17:27:29,3,50,helloyes,0.496,0.254,http://oursogo.com/thread-1628992-1-1.html
氣炸鍋,好康分享~上傳BB照片，便可登站參加抽獎,免費抽獎活動~抽iPad mini、氣炸鍋等大獎 http://gold.s26mama.com.tw/page/main.html 按取得登站資格後，會出現很簡單的拼圖 把...,討論區,ELLE > 生活分享,主文,2013-12-23 17:09:27,2,20,tellmewhy,0.233,0.2,http://bbs.elle.com.tw/thread-23079-1-1.html
氣炸鍋,購物網統計面膜年銷5百萬片,...「馬甲線」、「醫美」等風潮興起，健腹機、膠原蛋白粉、藍光除毛儀紛紛入榜。 值得一提的是，這半年食安問題層出不窮，慢磨機、氣炸鍋、製麵包機等各式DIY健康小家電，較去年成長2倍，擠進爆...,新聞,聯合新聞網_即時新聞 > 財經產業,主文,2013-12-23 14:30:00,0,0,台北23日電,0.506,0.218,http://udn.com/NEWS/BREAKINGNEWS/BREAKINGNEWS6/8378615.shtml
氣炸鍋,購物網統計面膜年銷5百萬片,...「馬甲線」、「醫美」等風潮興起，健腹機、膠原蛋白粉、藍光除毛儀紛紛入榜。 值得一提的是，這半年食安問題層出不窮，慢磨機、氣炸鍋、製麵包機等各式DIY健康小家電，較去年成長2倍，擠進爆...,新聞,MSN新聞 > 財經新聞,主文,2013-12-23 14:08:00,0,0,中央社,0.502,0.216,http://news.msn.com.tw/./news3489067.aspx
氣炸鍋,購物網統計面膜年銷5百萬片,...「馬甲線」、「醫美」等風潮興起，健腹機、膠原蛋白粉、藍光除毛儀紛紛入榜。 值得一提的是，這半年食安問題層出不窮，慢磨機、氣炸鍋、製麵包機等各式DIY健康小家電，較去年成長2倍，擠進爆...,新聞,中央社 > 財經新聞,主文,2013-12-23 13:47:56,0,0,中央社記者江明晏台北23日電,0.502,0.216,http://feedproxy.google.com/~r/rsscna/finance/~3/Lxz6SuSzACM/201312230178-1.aspx
氣炸鍋,購物網統計面膜年銷5百萬片,... 值得一提的是，這半年食安問題層出不窮，慢磨機、氣炸鍋、製麵包機等各式DIY健康小家電，較去年成長2倍，擠進爆紅商品中。  蕃plus + AD STAR...,新聞,yam天空 > 財經新聞,主文,2013-12-23 13:47:00,0,0,中央社,0.502,0.216,http://n.yam.com/cna/fn/20131223/20131223002768.html
氣炸鍋,購物網統計面膜年銷5百萬片,...「馬甲線」、「醫美」等風潮興起，健腹機、膠原蛋白粉、藍光除毛儀紛紛入榜。 值得一提的是，這半年食安問題層出不窮，慢磨機、氣炸鍋、製麵包機等各式DIY健康小家電，較去年成長2倍，擠進爆...,新聞,Sina新聞 > 台灣財經,主文,2013-12-23 13:47:00,0,0,中央社,0.501,0.216,http://news.sina.com.tw/article/20131223/11421404.html
氣炸鍋,購物網統計面膜年銷5百萬片,... 值得一提的是，這半年食安問題層出不窮，慢磨機、氣炸鍋、製麵包機等各式DIY健康小家電，較去年成長2倍，也擠進爆紅商品中。  蕃plus + AD STAR...,新聞,yam天空 > 財經新聞,主文,2013-12-23 13:35:00,0,0,中央商情網,0.502,0.217,http://n.yam.com/cnabc/fn/20131223/20131223002735.html
氣炸鍋,10大爆紅商品爆漿威化捲居冠,...平均每4位女性會員就有1人購買，智慧型手機和平板等3C商品普及，大容量行動電源登上前3名，「馬甲缐」、「醫美」風潮興起，讓健腹機、膠原蛋白粉等入榜，近半年食安問題層出不窮，慢磨機、氣炸鍋...,新聞,蘋果日報_即時新聞 > 即時新聞總覽,主文,2013-12-23 11:44:00,0,0,,0.457,0.194,http://www.appledaily.com.tw/realtimenews/article/life/20131223/313621/
氣炸鍋,老公在上班…小孩在睡覺…看大家po鄉村的早午餐突然好想吃...,老公在上班…小孩在睡覺…看大家po鄉村的早午餐突然好想吃……於是下樓自己亂用一通真是七早八早幹嘛把自己撐到爆……救命噢蘿蔔糕是彤媽家的…超級好吃噢！！ （冷凍香腸<span class='keywor...,社群網站,Facebook公眾訊息 > FbPublicMsg,主文,2013-12-23 04:00:18,6,141,黃小路,0.527,0.239,http://www.facebook.com/photo.php?fbid=10153589961680234
氣炸鍋,[心得]瑪莉屋口袋pizza,...就拿了新買的廚房玩具氣炸鍋來烤看看氣炸鍋內鍋不大，剛好一次只能烤一個...先預熱好後，溫度開200度Pizza底部用錫箔紙包一下(怕起司融化年在內鍋不好洗)丟進去烤8分鐘沒想...,社群網站,Ptt > e-shopping,主文,2013-12-22 23:06:37,3,0,loshen,0.342,0.279,http://www.ptt.cc/bbs/e-shopping/M.1387724801.A.6E4.html
氣炸鍋,Jura家用IMPRESSA F50 classic全自動研磨咖啡機比較推薦,...Jura家用系列ENA Micro 9 One Touch咖啡機 詳細說明※同類暢銷推薦↓↓免油料理更健康 大同氣炸鍋TOT-F1300 油量減少約80%，無油也可料理山丘型...,部落格,PcHome部落格 > PcHome BlogSearch搜尋結果,主文,2013-12-22 16:29:58,0,0,允瑤,0.494,0.173,http://mypaper.pchome.com.tw/vjqk5425/post/1326511598
氣炸鍋,完成四大營養拼圖，上傳寶貝照片，便可登站參加抽獎哦!,S26抽獎活動~抽iPad mini、氣炸鍋等大獎http://gold.s26mama.com.tw/page/main.html按取得登站資格後，會出現很簡單的拼圖把拼圖拼好，再把小...,討論區,BabyHome 寶貝家庭親子網 > 生活情報,主文,2013-12-22 11:48:41,11,0,志鈴,0.221,0.206,http://www.babyhome.com.tw/mboard/topic.php?&bid=2&sID=4276411
氣炸鍋,[買賣]全新飛利浦氣炸鍋,...全新飛利浦氣炸鍋商品價格：5500新舊狀況：試用過一次，尚餘10個月保固交易方式：面交唷！！聯絡方式：站內信送媽媽生日禮物但重複了！！只試用過一次，保存良好附保證書有送回原廠換特殊底部鐵...,社群網站,Ptt > BigBanciao,主文,2013-12-22 02:25:14,23,0,clioheart,0.191,0.161,http://www.ptt.cc/bbs/BigBanciao/M.1387650317.A.FBC.html
氣炸鍋,【按讚+留言★抽飛利浦負離子SPA按摩吹風機1支】 ...,... http://www.momoshop.com.tw/goods/GoodsDetail.jsp?i_code=2090072&cid=fb1219&oid=1500另外，折到往生價的飛利浦氣炸鍋<...,社群網站,facebook粉絲團 > momo富邦購物網,主文,2013-12-20 14:51:40,604,3969,momo富邦購物網,0.516,0.182,http://www.facebook.com/permalink.php?story_fbid=10152066729678431&id=165449553430
氣炸鍋,[每日好康]聲寶健康油切空氣炸鍋KZ-L12221BL ★福利價★,[每日好康]聲寶健康油切空氣炸鍋KZ-L12221BL該商品熱烈搶購中~欲購從速，以免向隅！因為我自己也想要了解[每日好康]聲寶健康油切空氣炸鍋KZ-L12221BL到處尋找...,部落格,udn部落格 > UDN BlogSearch搜尋結果,主文,2013-12-20 14:36:06,0,0,uyy12l20,0.525,0.336,http://blog.udn.com/uyy12l20/10033873
氣炸鍋,Re: [灑花]很慶幸有這樣的老媽,"...我的想法為優先,他也從來沒想要左右我的想法,只在我問他的時候他在說出自己的想法可能因為這樣,所以跟媽媽的關係很緊密,大學每天都會通電話,超無聊地哀個30秒也開心XDDDD真希望可以快賺多一點錢幫我媽...",社群網站,Ptt > WomenTalk,主文,2013-12-20 12:26:17,8,0,toma1224,0.352,0.328,http://www.ptt.cc/bbs/WomenTalk/M.1387513580.A.75F.html
氣炸鍋,【分享】不只能炸，還能燒烤、烘烤、烘焙的二代飛利浦健康氣炸鍋... ...,【本篇為飛利浦氣炸鍋邀稿文】 面對國內黑心食品連環爆，身為職業主婦的我，只能努力爭取時間進廚房，親自替全家人的健康把關。幸運地是拜科技進步所賜，現代煮婦不必在花費許多時間在廚房工作上...,討論區,開箱王 > 家電,主文,2013-12-20 12:24:00,0,70,amystalk,0.53,0.367,http://gounboxing.com/article-9347-1.html
氣炸鍋,三洋4-6坪變頻窗型冷氣SA-L28VA/SA-R28VA品牌推薦,"... TATUNG,尚朋堂,三洋,工業扇,工業扇,Whirlpool,尚朋堂,國際,國際牌,北方, sampo 32, bestech corporation,嘉儀循環扇,尚朋堂氣炸鍋,...",部落格,痞客邦 PIXNET > Pixnet BlogSearch搜尋結果,主文,2013-12-20 05:14:00,0,0,yo130821026,0.465,0.367,http://yo130821026.pixnet.net/blog/post/331711394
氣炸鍋,【鮮奶小姐上學記】聖誕節義賣&跳蚤市場,... 媽媽們有的是捐出自己家中的物品、自己做點心麵包、還有自己上山載好吃的農產品來義賣的 也有搬來卡式爐和蒸鍋來賣現蒸饅頭、帶氣炸鍋來賣炸薯條 廚房的煮飯媽媽也做了滷豆干來義賣(...,部落格,痞客邦 PIXNET > 珊卓‧心生活,主文,2013-12-20 00:35:00,1,0,珊卓,0.486,0.418,http://imsandra.pixnet.net/blog/post/29610180
氣炸鍋,消費趨勢分析-食安到居安，全面性的安心居家生活時代,... 更熱銷的自製料理小家電 這股因「食安危機」引發的自宅料理風潮，從2012年開始一直延燒到2013年，以廚房小家電為例，除了2012年持續熱銷的多功能調理機，生機果汁機、豆漿機及氣炸鍋</sp...,新聞,聯合新聞網 > 房市情報,主文,2013-12-20 00:00:00,0,0,,0.532,0.468,http://money.udn.com/house/storypage.jsp?f_MAIN_ID=416&f_SUB_ID=4075&f_ART_ID=301202
氣炸鍋,在家也可自己做簡單椒麻雞噢1.滑蛋：蛋+水+太白粉+醬油...,...辣椒.蒜頭.香菜切末.加水.胡椒粉.檸檬.醬油/油膏.泰式甜辣醬3.4.雞腿醃過醬油蒜頭後.擦點油.沾麵包粉或炸粉5.放入氣炸鍋10-15分（沒氣炸鍋就用鍋子吧） 6.高麗菜...,社群網站,Facebook公眾訊息 > FbPublicMsg,主文,2013-12-19 16:46:00,20,122,黃小路,0.174,0.496,http://www.facebook.com/photo.php?fbid=10153581089365234
氣炸鍋,Re: [心得]氣炸鍋處理雞肉還不錯...,※引述《seiko2023 (seiko)》之銘言：,社群網站,Ptt > MuscleBeach,主文,2013-12-19 12:08:14,24,0,neverwin,0,0,http://www.ptt.cc/bbs/MuscleBeach/M.1387426097.A.2B5.html
氣炸鍋,真多鍋要買,"有會出去玩,看朋友用萬用鍋很好用,心動想買,可是前陣子才買氣炸鍋.商人真會發明,真多鍋要買,我家已有大同電鍋.電子鍋.<span class=...",討論區,BabyHome 寶貝家庭親子網 > 閒聊專區,主文,2013-12-19 11:56:50,1,0,逆境是磨練,0.535,0,http://www.babyhome.com.tw/mboard/topic.php?&bid=6&sID=4275116
氣炸鍋,"最近很紅的""飛利浦免油健康氣炸鍋"",上網看了看原理,跟我...","最近很紅的""飛利浦免油健康氣炸鍋"",上網看了看原理,跟我家那台""旋風烘烤爐""的原理一模一樣,都是用熱風從上方加熱,使得食物可以均勻受熱.但氣炸鍋看來只能烤些小東西,而旋風烤爐...",社群網站,Facebook公眾訊息 > FbPublicMsg,主文,2013-12-19 08:12:37,1,2,Crane Lee,0.48,0,http://www.facebook.com/permalink.php?story_fbid=780297878650825&id=100000118600086
氣炸鍋,歌林搶市大家電電視變頻冷氣吸客,...據歌林統計，小家電主力在於生活和調理類家電，包括吸塵器、風扇、電磁爐、氣炸鍋、麵包機等，比重近7成。 此外，歌林表示，很多消費者以為循環扇是夏季家電，其實冬季也能派上用場，搭配除濕機...,新聞,yahoo新聞 > 科技,主文,2013-12-19 06:11:00,0,0,自由時報,0.237,0.205,http://tw.news.yahoo.com/%E6%AD%8C%E6%9E%97%E6%90%B6%E5%B8%82%E5%A4%A7%E5%AE%B6%E9%9B%BB-%E9%9B%BB%E8%A6%96%E8%AE%8A%E9%A0%BB%E5%86%B7%E6%B0%A3%E5%90%B8%E5%AE%A2-221105127.html
氣炸鍋,氣炸鍋第五作品：泰式椒麻雞（生平第一次做…成功好吃）醃好...,氣炸鍋第五作品：泰式椒麻雞（生平第一次做…成功好吃）醃好粿上粉沾點油下去約15分鐘…酥酥脆脆…噢耶另份同時平底鍋下去煎…天啊…好久…最後還是丟氣炸鍋憑著常吃暹羅的椒麻雞口感....,社群網站,Facebook公眾訊息 > FbPublicMsg,主文,2013-12-19 05:08:26,28,116,黃小路,0.535,0.232,http://www.facebook.com/photo.php?fbid=10153577347135234
氣炸鍋,最近接到很多人打電話來問:公司尾牙禮有甚麼好推薦~拜託!...,...) 7081TW http://goo.gl/SlrcW0 NO2:歌林不鏽鋼30公升旋風大烤箱(BO-LN301) http://goo.gl/qkgfGo NO3: PRINCESS荷蘭公主旋風...,社群網站,facebook粉絲團 > 反486受害者團結大聯盟,主文,2013-12-18 14:23:06,3,57,反486受害者團結大聯盟,0.517,0.161,http://www.facebook.com/permalink.php?story_fbid=679025972129481&id=140282406003843
